id,full_name,name,owner,description,topics,stargazers_count,subscribers_count,fork,forks_count,language,languages,open_issues_count,contributors_count,pushed_at,created_at,updated_at
154961058,kesar/eos-awesome-contracts,eos-awesome-contracts,kesar,List of open source contracts for EOSIO blockchains,"eosio, eos, eos-contracts",67,10,False,18,,,0,1,2019-06-05 06:35:55,2018-10-27 12:15:01,2021-03-23 15:35:09
155353360,WeBankFinTech/WeIdentity,WeIdentity,WeBankFinTech,基于区块链的符合W3C DID和Verifiable Credential规范的分布式身份解决方案,"blockchain, distributed-identity, distributed, did, data-exchange, w3c, privacy-preserving, selective-disclosure, privacy-protection, identity, verifiable-credentials, verifiable-presentation, certificate, dpki, digital-signature, consortium, kyc, weidentity, weid, weid-java-sdk",992,22,False,120,Java,"Java, Shell, XSLT, Smarty, Python",15,20,2021-06-10 10:43:25,2018-10-30 08:53:00,2021-06-13 06:24:23
155462298,tZERO-dev/T0ken,T0ken,tZERO-dev,"Regulatory compliant smart contracts built for the future of securities, leveraging the power, security, and transparency of the blockchain",,55,18,False,9,Makefile,Makefile,0,2,2019-12-19 17:18:49,2018-10-30 22:05:18,2021-04-13 17:14:13
155727813,paritytech/parity-zcash,parity-zcash,paritytech,Rust implementation of Zcash protocol ,"blockchain, zcash, rust, parity, node, client",150,27,False,33,Rust,"Rust, Shell",11,28,2019-10-08 05:47:10,2018-11-01 14:29:26,2021-06-21 00:44:00
156195539,umbracle/minimal,minimal,umbracle,Modular Ethereum client,"ethereum, client, blockchain",71,5,False,8,Go,"Go, Shell, Makefile",14,5,2020-07-16 07:33:31,2018-11-05 09:55:25,2021-05-26 14:37:28
156316723,wupeaking/tendermint_code_analysis,tendermint_code_analysis,wupeaking,通用区块链平台tendermint源码分析,"tendermint, blockchain, code, evm",141,15,False,46,HTML,HTML,0,1,2019-05-07 09:42:14,2018-11-06 02:52:18,2021-06-25 09:10:35
156448884,nearprotocol/NEARStudio,NEARStudio,nearprotocol,IDE for building smart contracts on NEAR Protocol,"blockchain, smart-contracts, ide, typescript, assemblyscript, webassembly",55,23,False,14,TypeScript,"TypeScript, JavaScript, CSS, Rust, HTML, Shell, WebAssembly, Dockerfile",60,41,2020-06-19 16:03:32,2018-11-06 21:16:12,2021-04-11 16:28:29
156468141,aws-samples/non-profit-blockchain,non-profit-blockchain,aws-samples,"Builds a blockchain network and application to track donations to non-profit organizations, using Amazon Managed Blockchain",,287,23,False,226,SCSS,"SCSS, JavaScript, Shell, TypeScript, HTML, Dockerfile",11,9,2021-06-09 09:12:53,2018-11-07 00:38:03,2021-06-26 12:18:53
156630861,tronprotocol/tron-contracts,tron-contracts,tronprotocol,Solidity smart contracts for the TRON blockchain https://tron.network,,59,10,False,73,JavaScript,JavaScript,3,3,2019-07-31 08:31:34,2018-11-08 01:14:35,2021-06-25 08:20:01
157034614,15Dkatz/cryptochain,cryptochain,15Dkatz,Build a blockchain-based cryptocurrency on the full stack course,,164,19,False,136,JavaScript,"JavaScript, CSS, HTML",8,1,2021-04-27 17:10:46,2018-11-11 00:38:47,2021-06-24 06:29:11
157076416,33cn/plugin,plugin,33cn,chain33 官方插件系统,"blockchain, framework, go, golang",70,9,False,90,Go,"Go, Shell, Assembly, Solidity, JavaScript, Makefile, C++, C, HTML, Dockerfile, Batchfile",27,29,2021-06-16 06:44:45,2018-11-11 12:17:30,2021-06-20 00:17:44
157153619,YaoyaoBae/simchain,simchain,YaoyaoBae,Simchain is a blockchain simulator for education and research purpose by Dr Pei.,,59,2,False,26,Python,Python,0,1,2018-11-15 03:02:03,2018-11-12 03:53:17,2021-06-20 13:39:40
157252412,OpenZeppelin/awesome-openzeppelin,awesome-openzeppelin,OpenZeppelin,Blockchain educational resources curated by the OpenZeppelin team,"blockchain, ethereum, awesome-list, openzeppelin",190,15,False,43,,,1,6,2020-10-14 22:04:51,2018-11-12 17:43:26,2021-06-27 17:22:04
157450306,unstoppabledomains/resolution,resolution,unstoppabledomains,A library to resolve blockchain domain names.,"resolution, blockchain, cns, zns, domains, ethereum",101,20,False,37,TypeScript,"TypeScript, JavaScript, Shell",15,16,2021-06-25 16:57:59,2018-11-13 21:36:30,2021-06-24 20:14:17
157935873,ElementsProject/simplicity,simplicity,ElementsProject,Simplicity is a blockchain programming language designed as an alternative to Bitcoin script.,,168,25,False,26,Tcl,"Tcl, C, Haskell, Coq, HTML, TeX, Nix, Makefile",16,4,2021-06-21 21:40:47,2018-11-17 00:23:53,2021-06-20 13:57:57
157979831,aa-miner/aaminer,aaminer,aa-miner,"AA Miner (BTC,BCH,LTC,XMR,DASH.. CryptoCoin Miner). Cryptocurrency(based on blockchain) Miner. AA Miner support 50+ algorithms.",,222,80,False,74,,,16,1,2020-03-28 20:27:36,2018-11-17 11:54:46,2021-06-27 15:11:29
158087990,planetarium/libplanet,libplanet,planetarium,Blockchain core in C#/.NET for persistent peer-to-peer online games,"libplanet, planetarium, game-development, csharp, dotnet, p2p, blockchain, unity, unity3d, hacktoberfest, net",332,29,False,89,C#,"C#, Shell, JavaScript, PowerShell, HTML",142,41,2021-06-27 15:02:44,2018-11-18 13:43:19,2021-06-21 07:17:43
158225088,nervosnetwork/ckb,ckb,nervosnetwork,"The Nervos CKB is a public permissionless blockchain, and the layer 1 of Nervos network.","nervos, blockchain, ckb, rust",840,65,False,155,Rust,"Rust, Python, Shell, HCL, Makefile, PowerShell, Dockerfile, Ruby, Batchfile",26,29,2021-06-27 04:11:21,2018-11-19 13:11:16,2021-06-27 10:53:49
158303450,nervosnetwork/ckb-vm,ckb-vm,nervosnetwork,"CKB's vm, based on open source RISC-V ISA","nervos, ckb, blockchain, rust, riscv, smart-contract",232,20,False,36,Rust,"Rust, C, Assembly, Makefile, Shell",5,13,2021-06-18 03:26:51,2018-11-19 23:29:41,2021-06-26 19:47:22
158328415,cleanunicorn/karl,karl,cleanunicorn,Monitor smart contracts deployed on blockchain and test against vulnerabilities with Mythril,,116,13,False,25,Python,"Python, Shell, Makefile",12,6,2021-06-10 12:46:03,2018-11-20 03:57:28,2021-06-27 11:30:05
159177009,AztecProtocol/AZTEC,AZTEC,AztecProtocol,Public repository for the AZTEC protocol,"protocol, zero-knowledge-proofs, ethereum, aztec, ethereum-blockchain, blockchain, privacy, confidentiality",497,30,False,75,JavaScript,"JavaScript, CSS, Solidity, HTML, Shell",54,13,2021-06-12 00:19:32,2018-11-26 13:50:05,2021-06-26 11:10:46
159546605,feitnomore/hyperledger-fabric-kubernetes,hyperledger-fabric-kubernetes,feitnomore,Blockchain Solution with Hyperledger Fabric + Hyperledger Explorer on Kubernetes,,107,13,False,75,Go,"Go, Shell",0,2,2019-07-01 18:35:13,2018-11-28 18:27:30,2021-06-27 08:32:50
159596686,ultiledger/utoken,utoken,ultiledger,"A mobile wallet which support Ripple, Stellar and other popular blockchain networks",,57,9,False,13,Vue,"Vue, HTML, JavaScript, CSS, Python",20,12,2021-05-28 01:08:56,2018-11-29 02:38:36,2021-04-29 06:52:21
159791622,oguzbilgic/zincir,zincir,oguzbilgic,Simple distributed blockchain experiment written in Ruby,"distributed, blockchain, ruby, cryptocurrency",77,7,False,11,Ruby,Ruby,1,1,2018-12-30 18:14:53,2018-11-30 08:22:33,2020-11-15 04:37:51
160499004,DE-labtory/koa,koa,DE-labtory,The koa is a high-level language that has more expressions than the bitcoin script and is simpler and easy to analyze ,"koa, language, blockchain, smartcontract-language",67,13,False,16,Go,"Go, Shell",24,9,2019-10-05 10:24:45,2018-12-05 10:09:40,2021-02-02 03:42:59
160548111,ethereum/evmone,evmone,ethereum,Fast Ethereum Virtual Machine implementation,"ethereum, ethereum-virtual-machine, evmc, evm, blockchain",201,19,False,62,C++,"C++, CMake, Python, C, Dockerfile, Shell",37,7,2021-06-25 14:11:49,2018-12-05 16:37:26,2021-06-25 03:42:13
160731309,neow3j/neow3j,neow3j,neow3j,Java/Kotlin/Android Development Toolkit for the Neo Blockchain,"neo, neo-blockchain, java, wallet, transaction, java-library, blockchain, raw-transaction, kotlin, scala, kotlin-android, scala-android, android, neo-node",101,8,False,18,Java,"Java, C#",50,6,2021-06-24 14:01:34,2018-12-06 21:00:09,2021-06-16 12:05:48
160805094,everitoken/evt4j,evt4j,everitoken,Official Java SDK for everiToken public chain. https://www.everitoken.io,"blockchain, everitoken, sdk, sdk-java",249,5,False,6,Java,Java,1,3,2021-03-31 21:43:57,2018-12-07 09:54:23,2021-06-26 01:15:19
160849048,IBM/global-financing-blockchain,global-financing-blockchain,IBM,A global finance application on blockchain developed using the IBM Blockchain Platform Extension for VS Code,"hyperledger-fabric, blockchain, fabric-network, nodejs",63,15,False,69,JavaScript,"JavaScript, HTML, CSS",11,8,2021-06-11 04:36:10,2018-12-07 16:32:20,2021-02-24 01:44:55
160871536,miguelmota/solidity-create2-example,solidity-create2-example,miguelmota,Example of how to use the CREATE2 opcode released in the Constantinople update for Ethereum,"solidity, ethereum, smart-contracts, blockchain, opcodes, create2, constantinople, evm",70,2,False,19,JavaScript,"JavaScript, Makefile",0,1,2020-08-03 23:48:54,2018-12-07 20:20:18,2021-06-15 10:25:51
161258122,Awesome-Layer-2/awesome-layer-2,awesome-layer-2,Awesome-Layer-2,All the layer 2 projects,"state-channels, blockchain, plasma",266,23,False,57,,,1,14,2020-09-05 15:59:24,2018-12-11 01:15:09,2021-06-16 03:57:32
161876407,bizanc/Bizanc.io.Core,Bizanc.io.Core,bizanc,Bizanc Blockchain,,115,24,False,19,C#,"C#, Dockerfile, Shell",4,3,2020-03-01 20:41:04,2018-12-15 06:18:47,2021-01-23 15:36:06
162481536,stellar/slingshot,slingshot,stellar," A new blockchain architecture under active development, with a strong focus on scalability, privacy and safety",,311,54,False,41,Rust,"Rust, HTML, Ruby, CSS, JavaScript",54,13,2021-04-02 23:02:46,2018-12-19 19:26:27,2021-06-25 14:13:03
162942129,xipfs/IPFS-Internals,IPFS-Internals,xipfs,IPFS 从入门到精通,"ipfs, blockchain, book, golang, filecoin, ipfs-filecoin",212,17,False,62,,,0,4,2020-11-30 02:08:59,2018-12-24 02:43:47,2021-06-18 08:32:10
163214922,xpn/BlockchainC2,BlockchainC2,xpn,A POC C2 server and agent to explore just if/how the Ethereum blockchain can be used for C2,,59,2,False,20,Go,"Go, Makefile",1,1,2019-04-05 10:52:56,2018-12-26 20:23:20,2021-06-07 13:27:55
164075108,worldsibu/hurley,hurley,worldsibu,The development environment toolset for blockchain projects,"blockchain, hyperledger-fabric, convector, hyperledger, developer-tools, development-environment",79,9,False,19,TypeScript,"TypeScript, JavaScript",37,8,2021-06-23 11:14:53,2019-01-04 07:41:51,2021-04-16 13:36:46
164176224,IBM/blockchainbean2,blockchainbean2,IBM,"This code pattern shows how to model a supply-chain network using the IBM Blockchain Platform and is based on a collaboration with Brooklyn Roasting Company. The story, along with the supply-chain documents that were used to model this network, can be found at: https://www.ibm.com/blockchainbean. Note that the 'view the blockchain' button is being migrated''","blockchain, hyperledger-fabric, nodejs, kubernetes",93,24,False,68,TypeScript,"TypeScript, JavaScript, HTML",19,2,2021-06-11 08:02:14,2019-01-05 02:56:33,2021-06-22 15:17:12
164228058,eddieoz/haal,haal,eddieoz,Hääl - Anonymous Electronic Voting System on Public Blockchains,"e-voting, blockchain, ethereum, zero-knowledge-proofs, smart-contracts, electronic-voting, voting-system, dapp, zk-snarks, homomorphic-encryption, stealth-wallets, digital-signatures, blockchains, protocol, whitepaper, ganache, proof, votes",80,13,False,12,JavaScript,JavaScript,6,4,2021-06-11 00:15:37,2019-01-05 15:40:31,2021-06-10 05:39:37
164251215,gochain/web3,web3,gochain,"A CLI tool to interact with web3 blockchains - Ethereum, GoChain, etc ",,84,8,False,23,Go,"Go, Solidity, Shell, Makefile, Dockerfile",21,9,2021-06-17 15:31:47,2019-01-05 21:07:13,2021-06-19 02:39:39
164321469,renepickhardt/The-Lightning-Network-Book,The-Lightning-Network-Book,renepickhardt,An open source and crowdfunded book about Bitcoins Lightning Network to scale blockchain technologies. ,,138,25,False,19,TeX,"TeX, Jupyter Notebook",10,5,2019-07-09 10:31:57,2019-01-06 15:45:18,2021-05-28 21:51:44
164526895,eosnewyork/eos-transit,eos-transit,eosnewyork,Transit Wallet Access Layer for EOS blockchain networks,,72,15,False,37,TypeScript,"TypeScript, HTML, Shell",86,14,2021-06-04 22:45:47,2019-01-08 01:20:19,2021-06-14 15:09:34
164716981,burst-apps-team/phoenix,phoenix,burst-apps-team,The official cross-platform wallet for the Burstcoin Blockchain Platform,,86,10,False,35,TypeScript,"TypeScript, SCSS, HTML, CSS, JavaScript, Handlebars, Objective-C, Java, Starlark, Ruby, Shell, Swift, C",55,13,2021-06-27 01:50:01,2019-01-08 19:19:44,2021-06-24 21:20:13
164790067,LayerXcom/zero-chain,zero-chain,LayerXcom,A privacy-preserving blockchain on Substrate,"substrate, zero-knowledge, blockchain, rust, zk-snarks",230,26,False,33,Rust,"Rust, Shell, Dockerfile",44,4,2019-12-24 05:58:38,2019-01-09 04:50:15,2021-05-20 05:36:11
165221451,Nethereum/Nethereum-Explorer-Wallet-Template-Blazor,Nethereum-Explorer-Wallet-Template-Blazor,Nethereum,"Nethereum Light Blockchain Explorer Explorer, Wallet using Blazor, ReactiveUI",,69,9,False,22,C#,"C#, HTML, CSS, JavaScript",6,4,2021-05-07 10:09:33,2019-01-11 09:59:11,2021-06-04 13:58:52
165279333,ConsenSysMesh/web3studio-bootleg,web3studio-bootleg,ConsenSysMesh,"The Shared Royalty Non-Fungible Token (a.k.a Bootleg) is an open source project started by the ConsenSys Web3Studio team.  The purpose of the Shared Royalty Non-Fungible Token (SRNFT) is to make any royalty business model, from the oil and gas industry to entertainment, easy to manage with the Ethereum blockchain .","ethereum, smart-contracts, drm, music, consensys, javascript, haskell, web3js, web3studio-bootleg",72,12,False,18,JavaScript,"JavaScript, Jupyter Notebook, Solidity, Ruby, HTML, Shell",19,4,2021-05-09 23:31:27,2019-01-11 17:02:14,2021-05-07 12:47:56
165467976,baozjian/Top-Blockchain-paper,Top-Blockchain-paper,baozjian,"Top Blockchain paper, such as CCS, NSDI, S&P, EuroS&P, CRYPTO, etc.","blockchains, papers",317,30,False,65,,,0,3,2021-06-03 09:19:05,2019-01-13 05:05:10,2021-06-26 11:46:25
165770137,nervosnetwork/neuron,neuron,nervosnetwork,Neuron: Nervos CKB Wallet,"nervos, blockchain, ckb, wallet",88,23,False,34,TypeScript,"TypeScript, SCSS, JavaScript, Shell, Ruby, HTML, CSS",17,17,2021-06-09 01:51:43,2019-01-15 02:23:55,2021-06-26 15:10:39
165784648,mhxw/hyperledger,hyperledger,mhxw,Blockchain、Hyperledger、Ethereum、IPFS learning materials / 学习指南,"ethereum, hyperledger, ipfs, blockchain, cosmos",61,5,False,32,HTML,HTML,0,1,2021-05-27 06:46:22,2019-01-15 04:21:50,2021-06-19 14:28:19
165966306,GeekLaunch/blockchain-rust,blockchain-rust,GeekLaunch,A basic blockchain implementation in Rust for educational purposes only,"blockchain, cryptocurrency, rust",86,6,False,27,Rust,Rust,1,1,2021-03-05 21:48:27,2019-01-16 03:23:41,2021-06-25 00:50:17
166121522,blocknative/assist,assist,blocknative,Blocknative Assist widget for blockchain usability,"dapp, onboard, widget",53,13,False,14,JavaScript,"JavaScript, CSS",28,6,2021-05-25 01:32:21,2019-01-16 22:26:08,2021-06-08 09:39:23
166223027,fractalplatform/fractal,fractal,fractalplatform,,"go, golang, blockchain, fractal",67,7,False,34,Go,"Go, Shell, Makefile",1,15,2020-08-11 02:45:25,2019-01-17 12:35:05,2021-05-01 22:50:01
166483773,near/near-wallet,near-wallet,near,Web wallet for NEAR Protocol which stores keys in browser's localStorage,"blockchain, wallet, react, nearprotocol, ledger",66,19,False,44,JavaScript,"JavaScript, CSS, HTML, Dockerfile, Shell",177,38,2021-06-26 03:05:24,2019-01-18 23:08:16,2021-06-26 22:11:25
166854527,IBM/IPFSfB,IPFSfB,IBM,InterPlanetary File System for Business (IPFSfB) is an enterprise blockchain storage network based on InterPlanetary File System.,"blockchain, ipfs, cryptography, p2p, protocol, distributed-file-system, networking",60,17,False,25,Go,"Go, Dockerfile, Makefile",0,3,2019-05-24 09:25:56,2019-01-21 17:38:47,2021-05-03 12:48:44
167159635,huan-xi/blockchainj,blockchainj,huan-xi,java区块链，实现联盟链溯源系统,,55,2,False,39,Java,Java,6,1,2019-04-29 13:25:21,2019-01-23 09:55:00,2021-05-24 06:00:50
167249899,EOSIO/eosio-swift,eosio-swift,EOSIO,EOSIO SDK for Swift - API for integrating with EOSIO-based blockchains,,60,25,False,25,C,"C, C++, Swift, Objective-C, Ruby, Shell",12,11,2021-04-12 16:38:52,2019-01-23 20:33:35,2021-05-21 06:20:24
167347719,appliedblockchain/k0,k0,appliedblockchain,A Zerocash based private token (and asset) implementation that integrates with both Ethereum and HL Fabric - create private tokens on smart contract consortium blockchains,,59,7,False,2,C++,"C++, JavaScript, Go, Python, Shell, AppleScript, CMake, Dockerfile",0,3,2019-10-30 17:05:23,2019-01-24 10:17:53,2021-06-27 02:16:02
167386196,yogdaan/blockchain-certification,blockchain-certification,yogdaan,Generation and validation of certificates using ethereum blockchain,"ethereum, ethereum-dapp, web3js, nodejs, react, docker, blockchain, certificates, certificate-generation, certificate-transparency, truffle, rinkeby-network, mnemonic, rpc-server, certificate, metamask, ganache, infura",52,7,False,24,JavaScript,"JavaScript, CSS, HTML, Dockerfile",6,5,2021-05-09 22:01:54,2019-01-24 15:03:53,2021-05-26 13:20:16
167748020,jianyu-niu/blockchain_conference_paper,blockchain_conference_paper,jianyu-niu,The existing blockchain-related academic papers. All papers are sorted according to the conference and published year.  Welcome developers or researchers to add more published papers to this list.,,371,48,False,98,,,0,7,2021-06-24 09:15:13,2019-01-26 22:56:04,2021-06-24 09:15:18
167964659,unwriter/B,B,unwriter,Store and reference data on the Bitcoin SV blockchain,,53,4,False,3,,,1,1,2019-04-12 11:35:26,2019-01-28 13:12:36,2021-06-17 23:31:54
167991422,portis-project/web-sdk,web-sdk,portis-project,Portis Web SDK,"portis, dapp, web-sdk, web3, ethereum, blockchain, sdk",65,4,False,23,TypeScript,"TypeScript, JavaScript",25,8,2021-06-25 16:29:54,2019-01-28 16:07:31,2021-06-22 05:32:28
168374929,unwriter/datapay,datapay,unwriter,Build and broadcast data transactions to the Bitcoin SV blockchain,,81,10,False,45,JavaScript,"JavaScript, HTML",16,5,2021-06-16 07:16:30,2019-01-30 16:23:21,2021-06-18 20:27:02
168390492,dappuniversity/eth-todo-list,eth-todo-list,dappuniversity,Blockchain Todo App Tutorial Powered by Ethereum Smart Contracts,,193,16,False,215,JavaScript,"JavaScript, HTML",9,1,2021-04-17 03:23:37,2019-01-30 18:09:46,2021-06-26 21:52:21
168464345,algorand/js-algorand-sdk,js-algorand-sdk,algorand,The official JavaScript SDK for Algorand.,"algorand, javascript, typescript, sdk, blockchain, node, browser",119,21,False,84,JavaScript,"JavaScript, TypeScript, Dockerfile, HTML, Shell, Makefile",26,32,2021-06-26 13:00:52,2019-01-31 04:44:59,2021-06-24 01:18:05
168659431,nexledger/accelerator,accelerator,nexledger,Accelerating the transaction processing performance of the enterprise blockchain.,"nexledger, accelerator, sds, samsung, hyperledger, caliper, fabric, blockchain",59,15,False,22,JavaScript,"JavaScript, Go, HTML, Python, Shell, PHP, Dockerfile",5,5,2020-10-27 20:35:46,2019-02-01 07:30:24,2021-04-15 11:12:26
168743792,Turing-Chain/Honeypots-on-Blockchain,Honeypots-on-Blockchain,Turing-Chain,This repo collects almost all the smart contract honeypots that you could find in the first three pages of Google search.,"blockchain, hack, security, smart-contracts, ethereum, honeypots",62,7,False,16,,,0,2,2019-04-20 03:06:29,2019-02-01 18:42:05,2021-04-19 23:53:09
168768578,holochain/cryptographic-autonomy-license,cryptographic-autonomy-license,holochain,The Cryptographic Autonomy License is a new breed of open license that protects not just the app developers and users of the source code but also end user privacy and control of identity and data.,"holochain, blockchain, license, cryptographic-keys, open-source",50,27,False,3,,,1,2,2019-12-18 19:21:52,2019-02-01 22:30:49,2021-06-18 06:59:05
169246942,vrde/ethnode,ethnode,vrde,Run an Ethereum node (Geth or Openethereum) for development,"ethereum, geth, smart-contracts, ethereum-node, blockchain, openethereum",94,6,False,20,JavaScript,"JavaScript, Shell, Dockerfile",7,5,2021-06-25 18:59:53,2019-02-05 13:38:37,2021-06-25 18:59:56
169292364,oasislabs/oasis-rs,oasis-rs,oasislabs,A humane blockchain programming framework.,"blockchain, wasm, wasi",59,22,False,12,Rust,"Rust, Dockerfile",35,9,2020-05-26 23:00:47,2019-02-05 18:41:42,2021-06-01 06:09:33
169360349,TokenScript/TokenScript,TokenScript,TokenScript,"TokenScript schema, specs and paper","tokens, xml, web3, mobile, cryptography, security, tokenization, tokenisation, blockchain",101,14,False,48,HTML,"HTML, Solidity, JavaScript, CSS, Makefile",84,15,2021-04-09 12:04:25,2019-02-06 05:38:54,2021-06-16 16:14:08
169431265,IBM/fabcar-blockchain-sample,fabcar-blockchain-sample,IBM,Use a Kubernetes cluster to deploy a Fabric network smart contract onto blockchain,"kubernetes, blockchain, hyperledger, fabric, containers",95,15,False,75,JavaScript,"JavaScript, TypeScript, CSS, HTML",27,7,2021-06-09 22:39:43,2019-02-06 15:50:10,2021-06-27 12:48:23
169809972,cosmos/ibc,ibc,cosmos,Interchain Standards (ICS) for the Cosmos network & interchain ecosystem.,"distributed-ledger, blockchain, interchain, cosmos",320,62,False,126,TeX,"TeX, Makefile",60,5,2021-06-25 16:13:20,2019-02-08 22:57:36,2021-06-21 01:51:20
170119292,IBM/Medical-Blockchain,Medical-Blockchain,IBM,A healthcare data management platform built on blockchain that stores medical data off-chain ,"blockchain, ibm-cloud, kubernetes, vuejs, redis, docker",95,19,False,61,Vue,"Vue, JavaScript, HTML, Shell, Dockerfile",5,2,2021-04-27 17:15:54,2019-02-11 11:43:04,2021-06-22 15:16:34
170685567,eosrio/hyperion-history-api,hyperion-history-api,eosrio,Scalable Full History API Solution for EOSIO based blockchains,,93,17,False,49,TypeScript,"TypeScript, JavaScript, HTML, Shell, CSS, Dockerfile, SCSS",14,9,2021-06-14 14:21:44,2019-02-14 12:09:00,2021-06-18 06:51:58
170738310,trustwallet/wallet-core,wallet-core,trustwallet,"Cross-platform, cross-blockchain wallet library.","blockchain, cross-platform, bitcoin, ethereum, crypto, cryptocurrency",850,65,False,635,C++,"C++, C, Swift, Kotlin, HTML, Ruby, Python, Shell, CMake, TypeScript, Dockerfile, Java, JavaScript, EJS, Objective-C",12,74,2021-06-24 03:11:48,2019-02-14 18:25:54,2021-06-25 06:42:21
170934393,near/near-cli,near-cli,near,General purpose command line tools for interacting with NEAR Protocol,"blockchain, smart-contracts, devtools, nearprotocol",70,16,False,26,JavaScript,"JavaScript, Shell",116,26,2021-06-26 19:54:56,2019-02-15 22:03:56,2021-06-23 05:10:24
172271425,CryptoLions/SimpleAssets,SimpleAssets,CryptoLions,A simple standard for digital assets (both fungible and NFTs - non-fungible tokens) for EOSIO blockchains,,81,12,False,42,C++,"C++, Shell, CMake",8,7,2021-06-10 21:10:59,2019-02-23 22:34:47,2021-06-13 06:42:08
172482623,goaiquant/GOAi,GOAi,goaiquant,,"java, quant, trading, algo-trading, investment, finance, cryptocurrency, bitcoin, bot, blockchain, btc, okex, huobipro, bitfinex",54,10,False,29,Java,"Java, Batchfile, Shell",0,1,2019-12-10 13:02:33,2019-02-25 10:14:13,2021-05-29 04:53:58
172735900,zilpay/zil-pay,zil-pay,zilpay,ZilPay browser extension enables browsing Zilliqa blockchain enabled websites.,"zilliqa, extension, chrome-extension, dapp, firefox-extension, blockchain, finance, cryptocurrency, wallet, javascript, vue, bitcoin, ethereum",53,10,False,10,JavaScript,"JavaScript, Vue, HTML, SCSS, CSS",3,3,2021-06-09 14:51:34,2019-02-26 15:15:44,2021-06-18 19:37:22
173167316,EOSIO/eosio-java,eosio-java,EOSIO,EOSIO SDK for Java - API for integrating with EOSIO-based blockchains,,113,18,False,42,Java,"Java, Shell",11,6,2021-04-09 20:04:27,2019-02-28 18:36:22,2021-05-30 01:45:07
173226802,CovenantSQL/CovenantForum,CovenantForum,CovenantSQL,CovenantForum is a simple Decentralized forum powered by CovenantSQL.,"p2p, forum, blockchain, covenantsql, cql",106,10,False,6,Go,"Go, JavaScript, CSS, HTML, Dockerfile",0,5,2019-05-15 03:34:45,2019-03-01 03:14:35,2021-05-15 16:30:26
173647175,IBM/Create-BlockchainNetwork-IBPV20,Create-BlockchainNetwork-IBPV20,IBM,Creating a basic Blockchain network using the IBM Blockchain Platform,"blockchain, vscode-extension, hyperledger-fabric",62,9,False,51,JavaScript,JavaScript,12,4,2021-06-11 00:04:38,2019-03-04 00:28:56,2021-06-26 16:57:49
173807098,instamed/healthcare-payments-blockchain,healthcare-payments-blockchain,instamed,"Healthcare Payments implemented on a HyperLedger Fabric 1.4 private, permission blockchain that uses Convector and HL7 FHIRv4","fhir, hyperledger-fabric, convector, typescript, healthcare, blockchain, nodejs, payment, insttamed",54,11,False,30,TypeScript,"TypeScript, Vue, JavaScript, Shell, HTML",18,3,2021-06-05 00:35:31,2019-03-04 19:23:31,2021-06-23 12:43:07
173946619,substrate-developer-hub/recipes,recipes,substrate-developer-hub,A Hands-On Cookbook for Aspiring Blockchain Chefs,"substrate, documentation",197,25,False,112,Rust,"Rust, Handlebars, JavaScript, CSS",55,38,2021-06-22 09:58:11,2019-03-05 12:56:32,2021-06-27 01:03:26
174452370,hyperledger/fabric-gateway-java,fabric-gateway-java,hyperledger,Hyperledger Fabric Gateway SDK for Java https://wiki.hyperledger.org/display/fabric,"hacktoberfest, hyperledger, fabric, blockchain, distributed-ledger, java",132,13,False,70,Java,"Java, Gherkin, Shell",1,14,2021-05-19 14:20:55,2019-03-08 02:07:22,2021-06-16 20:25:16
174510850,Joystream/joystream,joystream,Joystream,Joystream Monorepo,"joystream, substrate, rust, blockchain, cryptocurrency, typescript",67,15,False,56,TypeScript,"TypeScript, Rust, JavaScript, Shell, Sass, SCSS, HTML, Dockerfile, Jinja, Python, CSS, Batchfile",579,90,2021-06-25 16:40:54,2019-03-08 09:46:50,2021-06-24 14:22:34
